{
  "schemaVersion": 1,
  "releaseId": "v7-2",
  "modelVersion": "china-cup-v6",
  "recipeVersion": "porcelain-city-v6",
  "fixed": {
    "body": {
      "light": {
        "baseColor": {
          "id": "fixed-body-light-color",
          "url": "../v7-1/assets/fixed-body-light-color-8c2bf9cbe44a3d18.webp",
          "sha256": "8c2bf9cbe44a3d18658ede38822ce091abbcd9cfb3dbcf07557edede50cb97e7",
          "sourceSha256": "973cf1048f697acafd3bbe3f4bbdf6eb9ba46469572e571e35c1c5fad12d6559",
          "encoding": "webp",
          "width": 425,
          "height": 1024,
          "bytes": 151206,
          "decodedBytes": 1740800,
          "gpuBytes": 2321067,
          "channels": 4,
          "colorSpace": "srgb"
        },
        "normal": {
          "id": "fixed-body-light-normal",
          "url": "../v7-1/assets/fixed-body-light-normal-fc1a43461e425077.hfn.gz",
          "sha256": "fc1a43461e4250778580bc90584a118e7ce2a694864bf5d10fa539887fa6058d",
          "sourceSha256": "35f734f1f0e183864ac76dd6d7866f7e8c7eadf17f9e287950a986abb943b3db",
          "encoding": "hfn1-gzip",
          "width": 425,
          "height": 1024,
          "bytes": 915743,
          "decodedBytes": 3481600,
          "gpuBytes": 4642134,
          "channels": 4,
          "colorSpace": "linear"
        },
        "orm": {
          "id": "fixed-body-light-orm",
          "url": "../v7-1/assets/fixed-body-light-orm-038b21ee36c53021.webp",
          "sha256": "038b21ee36c530210af1767d212b5fae5a293adeffbb19dd2c94046e7a89bbe2",
          "sourceSha256": "f131df6c732aa03d2f7fd0b13cdf9912926a9410f96370f4417ee6c376f5b768",
          "encoding": "webp",
          "width": 425,
          "height": 1024,
          "bytes": 113944,
          "decodedBytes": 1740800,
          "gpuBytes": 2321067,
          "channels": 4,
          "colorSpace": "linear"
        }
      },
      "standard": {
        "baseColor": {
          "id": "fixed-body-standard-color",
          "url": "../v7-1/assets/fixed-body-standard-color-6f9be4cd52c23e29.webp",
          "sha256": "6f9be4cd52c23e293a2f608eabb4106b22fdabf46f7583ade448798e662ccdc0",
          "sourceSha256": "973cf1048f697acafd3bbe3f4bbdf6eb9ba46469572e571e35c1c5fad12d6559",
          "encoding": "webp",
          "width": 850,
          "height": 2048,
          "bytes": 389520,
          "decodedBytes": 6963200,
          "gpuBytes": 9284267,
          "channels": 4,
          "colorSpace": "srgb"
        },
        "normal": {
          "id": "fixed-body-standard-normal",
          "url": "../v7-1/assets/fixed-body-standard-normal-433099d227c03917.hfn.gz",
          "sha256": "433099d227c039173c918048bfdf3c3d4b9056d12eb864ad795e8c56891d7022",
          "sourceSha256": "35f734f1f0e183864ac76dd6d7866f7e8c7eadf17f9e287950a986abb943b3db",
          "encoding": "hfn1-gzip",
          "width": 850,
          "height": 2048,
          "bytes": 3466614,
          "decodedBytes": 13926400,
          "gpuBytes": 18568534,
          "channels": 4,
          "colorSpace": "linear"
        },
        "orm": {
          "id": "fixed-body-standard-orm",
          "url": "../v7-1/assets/fixed-body-standard-orm-4738736a95e92256.webp",
          "sha256": "4738736a95e92256e14a8e98e08ecc9a47cabefe79c154082ac221db3b0aa629",
          "sourceSha256": "f131df6c732aa03d2f7fd0b13cdf9912926a9410f96370f4417ee6c376f5b768",
          "encoding": "webp",
          "width": 850,
          "height": 2048,
          "bytes": 284336,
          "decodedBytes": 6963200,
          "gpuBytes": 9284267,
          "channels": 4,
          "colorSpace": "linear"
        }
      },
      "detail": {
        "baseColor": {
          "id": "fixed-body-detail-color",
          "url": "../v7-1/assets/fixed-body-detail-color-667b175ba4181dce.webp",
          "sha256": "667b175ba4181dce310c7214424116909e0d2fa60aa63ac1c78bf6d63da1edd1",
          "sourceSha256": "973cf1048f697acafd3bbe3f4bbdf6eb9ba46469572e571e35c1c5fad12d6559",
          "encoding": "webp",
          "width": 1024,
          "height": 2466,
          "bytes": 479504,
          "decodedBytes": 10100736,
          "gpuBytes": 13467648,
          "channels": 4,
          "colorSpace": "srgb"
        },
        "normal": {
          "id": "fixed-body-detail-normal",
          "url": "../v7-1/assets/fixed-body-detail-normal-35f734f1f0e18386.hfn.gz",
          "sha256": "35f734f1f0e183864ac76dd6d7866f7e8c7eadf17f9e287950a986abb943b3db",
          "sourceSha256": "35f734f1f0e183864ac76dd6d7866f7e8c7eadf17f9e287950a986abb943b3db",
          "encoding": "hfn1-gzip",
          "width": 1024,
          "height": 2466,
          "bytes": 4959453,
          "decodedBytes": 20201472,
          "gpuBytes": 26935296,
          "channels": 4,
          "colorSpace": "linear"
        },
        "orm": {
          "id": "fixed-body-detail-orm",
          "url": "../v7-1/assets/fixed-body-detail-orm-2f29c84c7465fc11.webp",
          "sha256": "2f29c84c7465fc11947162789e344dd257faf56c173546c8d47056e341b54681",
          "sourceSha256": "f131df6c732aa03d2f7fd0b13cdf9912926a9410f96370f4417ee6c376f5b768",
          "encoding": "webp",
          "width": 1024,
          "height": 2466,
          "bytes": 282582,
          "decodedBytes": 10100736,
          "gpuBytes": 13467648,
          "channels": 4,
          "colorSpace": "linear"
        }
      }
    },
    "handle": {
      "light": {
        "baseColor": {
          "id": "fixed-handle-light-color",
          "url": "../v7-1/assets/fixed-handle-light-color-701bfd4d526ffaeb.webp",
          "sha256": "701bfd4d526ffaeb41f9d2e58a3df190646c2c06ed04f70881a71a3848ec6a3d",
          "sourceSha256": "1bbe09ecdef463283f11c7f7319f80a05576311be5f28ff172eaf77751065e7e",
          "encoding": "webp",
          "width": 88,
          "height": 1024,
          "bytes": 39092,
          "decodedBytes": 360448,
          "gpuBytes": 480598,
          "channels": 4,
          "colorSpace": "srgb"
        },
        "normal": {
          "id": "fixed-handle-light-normal",
          "url": "../v7-1/assets/fixed-handle-light-normal-6c56e311d85ec224.hfn.gz",
          "sha256": "6c56e311d85ec22428d63ad4e8e395677d52f6410947b34816188fed38556590",
          "sourceSha256": "e40aff13da6fbc75109ea96e218871661f7524a70fde006f41fa86c1019cd1e2",
          "encoding": "hfn1-gzip",
          "width": 88,
          "height": 1024,
          "bytes": 217835,
          "decodedBytes": 720896,
          "gpuBytes": 961195,
          "channels": 4,
          "colorSpace": "linear"
        },
        "orm": {
          "id": "fixed-handle-light-orm",
          "url": "../v7-1/assets/fixed-handle-light-orm-8e8aef807eb4da9a.webp",
          "sha256": "8e8aef807eb4da9a49d6d18c8b429958c7998a010a72ab7422e6d1596f411b79",
          "sourceSha256": "e0da9f37e7fd58f3c0fde724765a073da9f935d551feb6f5df7bc14c707527c2",
          "encoding": "webp",
          "width": 88,
          "height": 1024,
          "bytes": 32544,
          "decodedBytes": 360448,
          "gpuBytes": 480598,
          "channels": 4,
          "colorSpace": "linear"
        }
      },
      "standard": {
        "baseColor": {
          "id": "fixed-handle-standard-color",
          "url": "../v7-1/assets/fixed-handle-standard-color-3fff075b8631c221.webp",
          "sha256": "3fff075b8631c221bd4a6f788bf9ba45a0d99372be2b140053b4c2be26f93630",
          "sourceSha256": "1bbe09ecdef463283f11c7f7319f80a05576311be5f28ff172eaf77751065e7e",
          "encoding": "webp",
          "width": 176,
          "height": 2048,
          "bytes": 112134,
          "decodedBytes": 1441792,
          "gpuBytes": 1922390,
          "channels": 4,
          "colorSpace": "srgb"
        },
        "normal": {
          "id": "fixed-handle-standard-normal",
          "url": "../v7-1/assets/fixed-handle-standard-normal-d07668c5b76c4af9.hfn.gz",
          "sha256": "d07668c5b76c4af977a31a130b91940ec50ee39000b5de9814d6301c3f6c53e5",
          "sourceSha256": "e40aff13da6fbc75109ea96e218871661f7524a70fde006f41fa86c1019cd1e2",
          "encoding": "hfn1-gzip",
          "width": 176,
          "height": 2048,
          "bytes": 824847,
          "decodedBytes": 2883584,
          "gpuBytes": 3844779,
          "channels": 4,
          "colorSpace": "linear"
        },
        "orm": {
          "id": "fixed-handle-standard-orm",
          "url": "../v7-1/assets/fixed-handle-standard-orm-6cdcbc339e7479b7.webp",
          "sha256": "6cdcbc339e7479b753ec1c0c2dbc74772b162525bc76662f5cc7ebdcdce5c73c",
          "sourceSha256": "e0da9f37e7fd58f3c0fde724765a073da9f935d551feb6f5df7bc14c707527c2",
          "encoding": "webp",
          "width": 176,
          "height": 2048,
          "bytes": 77988,
          "decodedBytes": 1441792,
          "gpuBytes": 1922390,
          "channels": 4,
          "colorSpace": "linear"
        }
      },
      "detail": {
        "baseColor": {
          "id": "fixed-handle-detail-color",
          "url": "../v7-1/assets/fixed-handle-detail-color-fc81742f4f583386.webp",
          "sha256": "fc81742f4f5833866f2f89c2a0af1ed866bab0325a1255b6165519d8bc4f1958",
          "sourceSha256": "1bbe09ecdef463283f11c7f7319f80a05576311be5f28ff172eaf77751065e7e",
          "encoding": "webp",
          "width": 352,
          "height": 4096,
          "bytes": 275636,
          "decodedBytes": 5767168,
          "gpuBytes": 7689558,
          "channels": 4,
          "colorSpace": "srgb"
        },
        "normal": {
          "id": "fixed-handle-detail-normal",
          "url": "../v7-1/assets/fixed-handle-detail-normal-2a8ea98e34842285.hfn.gz",
          "sha256": "2a8ea98e34842285305059c274539b0966dc4ab3842cad2204c6704369edc9ee",
          "sourceSha256": "e40aff13da6fbc75109ea96e218871661f7524a70fde006f41fa86c1019cd1e2",
          "encoding": "hfn1-gzip",
          "width": 352,
          "height": 4096,
          "bytes": 3115261,
          "decodedBytes": 11534336,
          "gpuBytes": 15379115,